{
  "library_id": "roma_architecture_library_v11",
  "name": "Roma Architecture Library V11",
  "version": "V11",
  "type": "houses",
  "engine": "Godot 4.7.2",
  "target": "Android",
  "destination": "city_library/buildings/houses/roma_architecture_library_v11",
  "approved": true,
  "dependencies": [],
  "modules": ["houses", "facades", "windows", "balconies"],
  "road_generator": false,
  "terrain3d_authoritative": true
}
